{
  "schema_version": "1.0",
  "inventory_version": "2026-10-a1-unit-01",
  "content_status": "UNREVIEWED",
  "records": [
    {"id":"vocab-en-hello-001","language":"en","band":"A1","tier":"A1.1","lemma":"hello","sense_number":1,"part_of_speech":"interjection","definition":"a word used when you meet or speak to someone","vietnamese_meaning":"xin chào","ipa":"/həˈləʊ/","examples":["Hello, I am An."],"collocations":["say hello"],"introduction_lesson_id":"m16a1-v1-a1-u01-l01","recall_prompt":"Write the English greeting for ‘xin chào’. ","accepted_answers":["hello"],"distractors":["goodbye","name"],"exercise_bindings":[{"lesson_id":"m16a1-v1-a1-u01-l01","exercise_id":"meaning-check","source_target_id":"a1t_u01_social_greetings","packet_sha256":"d152933bfa60dd42c4286f16a62c6db9ae7b7dd8a97070e8b43e9f97ad96a62f"}],"content_status":"UNREVIEWED"},
    {"id":"vocab-en-hi-001","language":"en","band":"A1","tier":"A1.1","lemma":"hi","sense_number":1,"part_of_speech":"interjection","definition":"an informal word used to greet someone","vietnamese_meaning":"chào","ipa":"/haɪ/","examples":["Hi, Mai!"],"collocations":["say hi"],"introduction_lesson_id":"m16a1-v1-a1-u01-l01","recall_prompt":"Write the informal English greeting ‘chào’. ","accepted_answers":["hi"],"distractors":["hello","goodbye"],"exercise_bindings":[{"lesson_id":"m16a1-v1-a1-u01-l01","exercise_id":"form-match","source_target_id":"a1t_u01_social_greetings","packet_sha256":"d152933bfa60dd42c4286f16a62c6db9ae7b7dd8a97070e8b43e9f97ad96a62f"}],"content_status":"UNREVIEWED"},
    {"id":"vocab-en-goodbye-001","language":"en","band":"A1","tier":"A1.1","lemma":"goodbye","sense_number":1,"part_of_speech":"interjection","definition":"a word used when you leave someone","vietnamese_meaning":"tạm biệt","ipa":"/ˌɡʊdˈbaɪ/","examples":["Goodbye. See you tomorrow."],"collocations":["say goodbye"],"introduction_lesson_id":"m16a1-v1-a1-u01-l01","recall_prompt":"Write the English word for ‘tạm biệt’. ","accepted_answers":["goodbye"],"distractors":["hello","hi"],"exercise_bindings":[{"lesson_id":"m16a1-v1-a1-u01-l01","exercise_id":"meaning-check","source_target_id":"a1t_u01_social_greetings","packet_sha256":"d152933bfa60dd42c4286f16a62c6db9ae7b7dd8a97070e8b43e9f97ad96a62f"}],"content_status":"UNREVIEWED"},
    {"id":"vocab-en-greeting-001","language":"en","band":"A1","tier":"A1.1","lemma":"greeting","sense_number":1,"part_of_speech":"noun","definition":"something you say when you meet a person","vietnamese_meaning":"lời chào","ipa":"/ˈɡriːtɪŋ/","examples":["Hello is a greeting."],"collocations":["a friendly greeting"],"introduction_lesson_id":"m16a1-v1-a1-u01-l01","recall_prompt":"Write the English noun for ‘lời chào’. ","accepted_answers":["greeting"],"distractors":["goodbye","letter"],"exercise_bindings":[{"lesson_id":"m16a1-v1-a1-u01-l01","exercise_id":"form-match","source_target_id":"a1t_u01_social_greetings","packet_sha256":"d152933bfa60dd42c4286f16a62c6db9ae7b7dd8a97070e8b43e9f97ad96a62f"}],"content_status":"UNREVIEWED"},
    {"id":"vocab-en-name-001","language":"en","band":"A1","tier":"A1.1","lemma":"name","sense_number":1,"part_of_speech":"noun","definition":"the word or words that identify a person","vietnamese_meaning":"tên","ipa":"/neɪm/","examples":["My name is Phúc."],"collocations":["your name"],"introduction_lesson_id":"m16a1-v1-a1-u01-l02","recall_prompt":"Write the English word for ‘tên’. ","accepted_answers":["name"],"distractors":["student","country"],"exercise_bindings":[{"lesson_id":"m16a1-v1-a1-u01-l02","exercise_id":"language-gap","source_target_id":"a1t_u01_introducing_yourself","packet_sha256":"fa9c93c8a45547c81391bda5b706d32cf7996c9f019f50bd9a467840a72d3dc3"}],"content_status":"UNREVIEWED"},
    {"id":"vocab-en-student-001","language":"en","band":"A1","tier":"A1.1","lemma":"student","sense_number":1,"part_of_speech":"noun","definition":"a person who studies at a school, college, or university","vietnamese_meaning":"học sinh; sinh viên","ipa":"/ˈstjuːdənt/","examples":["Linh is a student."],"collocations":["a new student"],"introduction_lesson_id":"m16a1-v1-a1-u01-l02","recall_prompt":"Write the English word for ‘học sinh; sinh viên’. ","accepted_answers":["student"],"distractors":["teacher","name"],"exercise_bindings":[{"lesson_id":"m16a1-v1-a1-u01-l02","exercise_id":"language-gap","source_target_id":"a1t_u01_introducing_yourself","packet_sha256":"fa9c93c8a45547c81391bda5b706d32cf7996c9f019f50bd9a467840a72d3dc3"}],"content_status":"UNREVIEWED"},
    {"id":"vocab-en-introduce-001","language":"en","band":"A1","tier":"A1.1","lemma":"introduce","sense_number":1,"part_of_speech":"verb","definition":"to tell someone your name or another basic fact about you","vietnamese_meaning":"giới thiệu","ipa":"/ˌɪntrəˈdjuːs/","examples":["Please introduce yourself."],"collocations":["introduce yourself"],"introduction_lesson_id":"m16a1-v1-a1-u01-l02","recall_prompt":"Write the English verb for ‘giới thiệu’. ","accepted_answers":["introduce"],"distractors":["spell","greet"],"exercise_bindings":[{"lesson_id":"m16a1-v1-a1-u01-l02","exercise_id":"practice-order","source_target_id":"a1t_u01_introducing_yourself","packet_sha256":"fa9c93c8a45547c81391bda5b706d32cf7996c9f019f50bd9a467840a72d3dc3"}],"content_status":"UNREVIEWED"},
    {"id":"vocab-en-yourself-001","language":"en","band":"A1","tier":"A1.1","lemma":"yourself","sense_number":1,"part_of_speech":"pronoun","definition":"the person that you are talking to or about","vietnamese_meaning":"bản thân bạn","ipa":"/jɔːˈself/","examples":["Introduce yourself, please."],"collocations":["about yourself"],"introduction_lesson_id":"m16a1-v1-a1-u01-l02","recall_prompt":"Write the English word for ‘bản thân bạn’. ","accepted_answers":["yourself"],"distractors":["myself","student"],"exercise_bindings":[{"lesson_id":"m16a1-v1-a1-u01-l02","exercise_id":"practice-order","source_target_id":"a1t_u01_introducing_yourself","packet_sha256":"fa9c93c8a45547c81391bda5b706d32cf7996c9f019f50bd9a467840a72d3dc3"}],"content_status":"UNREVIEWED"},
    {"id":"vocab-en-from-001","language":"en","band":"A1","tier":"A1.1","lemma":"from","sense_number":1,"part_of_speech":"preposition","definition":"used to show the place where someone begins or lives originally","vietnamese_meaning":"từ; đến từ","ipa":"/frɒm/","examples":["I am from Đà Nẵng."],"collocations":["be from"],"introduction_lesson_id":"m16a1-v1-a1-u01-l03","recall_prompt":"Write the English preposition for ‘đến từ’. ","accepted_answers":["from"],"distractors":["where","country"],"exercise_bindings":[{"lesson_id":"m16a1-v1-a1-u01-l03","exercise_id":"detail-check","source_target_id":"a1t_u01_personal_origin","packet_sha256":"593bcf9f70ab3ae32d112577f121766657a0641995aee4fe0f58c4bccd359d93"}],"content_status":"UNREVIEWED"},
    {"id":"vocab-en-where-001","language":"en","band":"A1","tier":"A1.1","lemma":"where","sense_number":1,"part_of_speech":"adverb","definition":"used to ask about a place","vietnamese_meaning":"ở đâu","ipa":"/weə/","examples":["Where are you from?"],"collocations":["where are you from"],"introduction_lesson_id":"m16a1-v1-a1-u01-l03","recall_prompt":"Write the English question word for ‘ở đâu’. ","accepted_answers":["where"],"distractors":["when","from"],"exercise_bindings":[{"lesson_id":"m16a1-v1-a1-u01-l03","exercise_id":"detail-check","source_target_id":"a1t_u01_personal_origin","packet_sha256":"593bcf9f70ab3ae32d112577f121766657a0641995aee4fe0f58c4bccd359d93"}],"content_status":"UNREVIEWED"},
    {"id":"vocab-en-country-001","language":"en","band":"A1","tier":"A1.1","lemma":"country","sense_number":1,"part_of_speech":"noun","definition":"an area of land with its own government","vietnamese_meaning":"đất nước; quốc gia","ipa":"/ˈkʌntri/","examples":["Vietnam is my country."],"collocations":["your country"],"introduction_lesson_id":"m16a1-v1-a1-u01-l03","recall_prompt":"Write the English noun for ‘đất nước; quốc gia’. ","accepted_answers":["country"],"distractors":["hometown","number"],"exercise_bindings":[{"lesson_id":"m16a1-v1-a1-u01-l03","exercise_id":"form-match","source_target_id":"a1t_u01_personal_origin","packet_sha256":"593bcf9f70ab3ae32d112577f121766657a0641995aee4fe0f58c4bccd359d93"}],"content_status":"UNREVIEWED"},
    {"id":"vocab-en-hometown-001","language":"en","band":"A1","tier":"A1.1","lemma":"hometown","sense_number":1,"part_of_speech":"noun","definition":"the town or city where a person grew up or comes from","vietnamese_meaning":"quê nhà; quê quán","ipa":"/ˈhəʊmtaʊn/","examples":["Cần Thơ is my hometown."],"collocations":["my hometown"],"introduction_lesson_id":"m16a1-v1-a1-u01-l03","recall_prompt":"Write the English word for ‘quê nhà; quê quán’. ","accepted_answers":["hometown"],"distractors":["country","student"],"exercise_bindings":[{"lesson_id":"m16a1-v1-a1-u01-l03","exercise_id":"form-match","source_target_id":"a1t_u01_personal_origin","packet_sha256":"593bcf9f70ab3ae32d112577f121766657a0641995aee4fe0f58c4bccd359d93"}],"content_status":"UNREVIEWED"},
    {"id":"vocab-en-spell-001","language":"en","band":"A1","tier":"A1.1","lemma":"spell","sense_number":1,"part_of_speech":"verb","definition":"to say or write the letters of a word in order","vietnamese_meaning":"đánh vần","ipa":"/spel/","examples":["Can you spell your name?"],"collocations":["spell a name"],"introduction_lesson_id":"m16a1-v1-a1-u01-l04","recall_prompt":"Write the English verb for ‘đánh vần’. ","accepted_answers":["spell"],"distractors":["write","introduce"],"exercise_bindings":[{"lesson_id":"m16a1-v1-a1-u01-l04","exercise_id":"detail-check","source_target_id":"a1t_u01_alphabet_and_spelling","packet_sha256":"260254f86145074dfea6453eb3dd659a574d4b78856a58d236769fe961b11d55"}],"content_status":"UNREVIEWED"},